covariate_id,covariate_name,analysis_id,concept_id
434944101,condition_occurrence: Scleritis,101,434944
4138403101,condition_occurrence: Polyp of nasal sinus,101,4138403
438761101,condition_occurrence: Acute dacryocystitis,101,438761
434932101,condition_occurrence: Fuchs' heterochromic cyclitis,101,434932
432777101,condition_occurrence: Poisoning by antivaricose drug AND/OR sclerosing agent,101,432777
434656101,condition_occurrence: Vertebral artery syndrome,101,434656
436326101,condition_occurrence: Faucial diphtheria,101,436326
436671101,condition_occurrence: Carcinoma in situ of anal canal,101,436671
76472101,condition_occurrence: Dysplasia of anus,101,76472
379818101,condition_occurrence: Retrobulbar neuritis,101,379818
320739101,condition_occurrence: Dissection of aorta,101,320739
198100101,condition_occurrence: Carcinoid tumor of small intestine,101,198100
436546101,condition_occurrence: Strain of subscapularis muscle,101,436546
195197101,condition_occurrence: Primary malignant neoplasm of vulva,101,195197
78273101,condition_occurrence: Closed fracture of multiple ribs,101,78273
440374101,condition_occurrence: Obsessive-compulsive disorder,101,440374
4088920101,condition_occurrence: Uterus absent,101,4088920
433505101,condition_occurrence: Subclavian steal syndrome,101,433505
444055101,condition_occurrence: Thrombophlebitis of superficial veins of lower extremity,101,444055
81983101,condition_occurrence: Multiple dislocations,101,81983
4162218101,condition_occurrence: Vaginal enterocele,101,4162218
4301471101,condition_occurrence: Disorder of the lower urinary tract,101,4301471
4107655101,condition_occurrence: Finding relating to psychosocial functioning,101,4107655
436348101,condition_occurrence: Primary malignant neoplasm of anal canal,101,436348
436145101,condition_occurrence: Pneumonia due to respiratory syncytial virus,101,436145
432941101,condition_occurrence: Disorder of tongue,101,432941
437308101,condition_occurrence: Basilar artery occlusion,101,437308
381024101,condition_occurrence: Lacrimal gland cyst,101,381024
73866101,condition_occurrence: Congenital anomaly of breast,101,73866
78149101,condition_occurrence: Congenital hereditary muscular dystrophy,101,78149
196431101,condition_occurrence: Hypersensitivity angiitis,101,196431
435123101,condition_occurrence: Injury of nerve roots AND/OR spinal plexus of multiple sites,101,435123
79240101,condition_occurrence: Prosthetic joint dislocation,101,79240
436948101,condition_occurrence: Benign neoplasm of choroid,101,436948
437409101,condition_occurrence: Intracranial injury,101,437409
443625101,condition_occurrence: Gender identity disorder of adulthood,101,443625
193598101,condition_occurrence: Extravasation of urine,101,193598
379779101,condition_occurrence: Subacute delirium,101,379779
434455101,condition_occurrence: Acquired claw toes,101,434455
198810101,condition_occurrence: Vulval intraepithelial neoplasia grade 2,101,198810
437209101,condition_occurrence: Echovirus meningitis,101,437209
373972101,condition_occurrence: Histoplasmosis with retinitis,101,373972
439941101,condition_occurrence: Closed fracture of condyle of humerus,101,439941
4192735101,"condition_occurrence: Furuncle of head, except face",101,4192735
436045101,"condition_occurrence: Malignant neoplasm of lip, oral cavity and pharynx",101,436045
4175848101,condition_occurrence: Monoarthritis of hip joint,101,4175848
4168226101,condition_occurrence: Micturition frequency and polyuria,101,4168226
440851101,condition_occurrence: Open fracture of forearm,101,440851
73090101,condition_occurrence: Contusion of foot,101,73090
30969101,condition_occurrence: Testicular hyperfunction,101,30969
438979101,condition_occurrence: Primary malignant neoplasm of hepatic flexure of colon,101,438979
440237101,condition_occurrence: Open fracture of upper end of lower leg,101,440237
313989101,condition_occurrence: Chronic lymphadenitis,101,313989
380113101,condition_occurrence: Hemorrhage in optic nerve sheaths,101,380113
439947101,condition_occurrence: Open fracture of upper end of fibula,101,439947
440686101,condition_occurrence: Residual schizophrenia in remission,101,440686
382014101,condition_occurrence: Injury of facial nerve,101,382014
438000101,condition_occurrence: Open fracture of third cervical vertebra,101,438000
439306101,condition_occurrence: Recent total retinal detachment,101,439306
199066101,condition_occurrence: Female digestive-genital tract fistula,101,199066
80819101,condition_occurrence: Acquired hallux varus,101,80819
195195101,condition_occurrence: Malignant lymphoma of intrapelvic lymph nodes,101,195195
200164101,condition_occurrence: Diaper rash,101,200164
4167777101,condition_occurrence: Analgesic allergy,101,4167777
374055101,condition_occurrence: Basilar artery syndrome,101,374055
261053101,condition_occurrence: Pneumonia in aspergillosis,101,261053
76122101,condition_occurrence: Brown's tendon sheath syndrome,101,76122
378014101,condition_occurrence: Open wound of external ear with complication,101,378014
30679101,condition_occurrence: Benign neoplasm of major salivary gland,101,30679
4110815101,"condition_occurrence: Sensorineural hearing loss, bilateral",101,4110815
4095589101,condition_occurrence: Malignant melanoma of ear and/or external auditory canal,101,4095589
435805101,condition_occurrence: Cerebrospinal fluid rhinorrhea,101,435805
318437101,condition_occurrence: Malignant secondary hypertension,101,318437
4249016101,condition_occurrence: Benign secondary renovascular hypertension,101,4249016
442555101,condition_occurrence: Breathing painful,101,442555
4083695101,condition_occurrence: Osteoarthritis of elbow,101,4083695
440105101,condition_occurrence: Aqueous humor misdirect,101,440105
434527101,condition_occurrence: Poisoning by primarily systemic agent,101,434527
438624101,condition_occurrence: Complication of renal dialysis,101,438624
198101101,condition_occurrence: Lipoma of skin and subcutaneous tissue,101,198101
4233565101,condition_occurrence: Severe protein-calorie malnutrition,101,4233565
374377101,condition_occurrence: Paralytic syndrome,101,374377
440940101,condition_occurrence: Methicillin resistant Staphylococcus aureus infection,101,440940
74722101,condition_occurrence: Secondary localized osteoarthrosis of pelvic region,101,74722
75004101,condition_occurrence: Frank hematuria,101,75004
374923101,condition_occurrence: Bell's palsy,101,374923
78227101,condition_occurrence: Degenerative joint disease of hand,101,78227
434502101,condition_occurrence: Closed fracture of phalanx of foot,101,434502
439727101,condition_occurrence: Human immunodeficiency virus infection,101,439727
75954101,condition_occurrence: Sprain of interphalangeal joint of finger,101,75954
193804101,condition_occurrence: Achlorhydria,101,193804
259043101,condition_occurrence: Emphysematous bleb of lung,101,259043
313232101,condition_occurrence: Hemodialysis-associated hypotension,101,313232
74130101,condition_occurrence: Thoracic spondylosis without myelopathy,101,74130
377298101,condition_occurrence: Chronic otitis externa,101,377298
437906101,condition_occurrence: Pulmonary alveolar microlithiasis,101,437906
436539101,condition_occurrence: Closed fracture of patella,101,436539
381295101,condition_occurrence: Senile cataract,101,381295
199064101,condition_occurrence: Chronic vascular insufficiency of intestine,101,199064
81893101,condition_occurrence: Ulcerative colitis,101,81893
193020101,condition_occurrence: Incomplete emptying of bladder,101,193020
78586101,condition_occurrence: Sprain of interphalangeal joint of toe,101,78586
195593101,condition_occurrence: Hydrocele of canal of Nuck,101,195593
435666101,condition_occurrence: Closed fracture of upper end of tibia,101,435666
377869101,condition_occurrence: Conjunctival deposit,101,377869
381017101,condition_occurrence: Refractive amblyopia,101,381017
439672101,condition_occurrence: Viral hepatitis C with coma,101,439672
4043731101,condition_occurrence: Infarction - precerebral,101,4043731
261325101,condition_occurrence: Pulmonary emphysema,101,261325
317307101,condition_occurrence: Idiopathic myocarditis,101,317307
374326101,condition_occurrence: Arteriosclerotic dementia with depression,101,374326
435993101,condition_occurrence: Foreign body in conjunctival sac,101,435993
138667101,condition_occurrence: Stoma finding,101,138667
432672101,condition_occurrence: Fissure of nipple,101,432672
443612101,condition_occurrence: Chronic kidney disease stage 4,101,443612
319843101,condition_occurrence: Mitral valve disorder,101,319843
433893101,condition_occurrence: Open fracture of epiphysis of femur,101,433893
4102654101,condition_occurrence: Hereditary retinal dystrophies in lipidoses,101,4102654
380500101,condition_occurrence: Hypertrophy of fat pad of knee,101,380500
437093101,condition_occurrence: Congenital ptosis,101,437093
444202101,condition_occurrence: Abscess,101,444202
74126101,condition_occurrence: Protrusio acetabuli of the pelvic region and thigh,101,74126
197019101,condition_occurrence: Bile duct calculus with acute cholecystitis and no obstruction,101,197019
140364101,condition_occurrence: Disorder of thyrocalcitonin secretion,101,140364
380094101,condition_occurrence: Carpal tunnel syndrome,101,380094
76565101,condition_occurrence: Contusion of shoulder region,101,76565
4173243101,condition_occurrence: Perforation with diverticular disease of colon,101,4173243
4049810101,condition_occurrence: Inflammatory neuropathy,101,4049810
436919101,condition_occurrence: Primary malignant neoplasm of unspecified site,101,436919
4242416101,condition_occurrence: Cutis laxa,101,4242416
79898101,condition_occurrence: Cellulitis and abscess of finger,101,79898
78235101,condition_occurrence: Disorder of coccyx,101,78235
442185101,condition_occurrence: Allescheriosis,101,442185
40490929101,condition_occurrence: Primary malignant neoplasm of intrahepatic bile duct,101,40490929
136710101,condition_occurrence: Perichondritis of pinna,101,136710
443458101,condition_occurrence: Closed fracture of facial bone,101,443458
132703101,condition_occurrence: Lichen planus,101,132703
436941101,condition_occurrence: Hypervitaminosis A,101,436941
193631101,condition_occurrence: Injury of internal organ,101,193631
439297101,condition_occurrence: Nuclear senile cataract,101,439297
196159101,condition_occurrence: Old laceration of muscles of pelvic floor,101,196159
260135101,condition_occurrence: Complete bilateral paralysis of vocal cords,101,260135
377802101,condition_occurrence: Late effects of poliomyelitis,101,377802
78474101,condition_occurrence: Hypertrophy of breast,101,78474
432602101,condition_occurrence: Fungal meningitis,101,432602
4164568101,condition_occurrence: Femoral hernia with gangrene,101,4164568
137520101,condition_occurrence: Chronic thyroiditis,101,137520
433513101,condition_occurrence: Acute epiglottitis with obstruction,101,433513
436658101,condition_occurrence: Vitamin deficiency,101,436658
40481346101,condition_occurrence: Poisoning due to chemical substance,101,40481346
258061101,condition_occurrence: Pulmonary tularemia,101,258061
4111091101,condition_occurrence: Acute myocarditis - meningococcal,101,4111091
318450101,condition_occurrence: Cardiac tamponade,101,318450
136496101,condition_occurrence: Cellulitis and abscess of face,101,136496
435119101,condition_occurrence: Late effect of injury,101,435119
442753101,condition_occurrence: Furuncle of trunk,101,442753
374053101,condition_occurrence: Sudden hearing loss,101,374053
319041101,condition_occurrence: Orthostatic hypotension,101,319041
372721101,condition_occurrence: Congenital anomaly of cerebrovascular system,101,372721
376714101,condition_occurrence: Vertebrobasilar artery syndrome,101,376714
134746101,condition_occurrence: Finger clubbing,101,134746
200757101,condition_occurrence: Abscess of peritoneum,101,200757
81763101,condition_occurrence: Frostbite of hand,101,81763
259824101,condition_occurrence: Round window fistula,101,259824
434610101,condition_occurrence: Hyperkalemia,101,434610
136198101,condition_occurrence: Cervical spondylosis with myelopathy,101,136198
437894101,condition_occurrence: Ventricular fibrillation,101,437894
135895101,condition_occurrence: Variation in hair color,101,135895
138255101,condition_occurrence: Abnormal cardiovascular function,101,138255
437827101,condition_occurrence: Pure hypercholesterolemia,101,437827
4147972101,condition_occurrence: Specific academic or work inhibition,101,4147972
440238101,condition_occurrence: Closed fracture of metatarsal bone,101,440238
197506101,condition_occurrence: Malignant neoplasm of abdomen,101,197506
438722101,condition_occurrence: Non megaloblastic anemia associated with nutritional deficiency,101,438722
432283101,condition_occurrence: Leukemoid reaction,101,432283
374888101,condition_occurrence: Dementia associated with another disease,101,374888
381287101,condition_occurrence: Retained magnetic foreign body in lens,101,381287
74082101,condition_occurrence: Acontractile detrusor,101,74082
78607101,condition_occurrence: Open wound of multiple sites of one upper limb with complication,101,78607
440035101,condition_occurrence: Cryptococcosis,101,440035
440755101,"condition_occurrence: Acute duodenal ulcer without hemorrhage, without perforation AND without obstruction",101,440755
134596101,condition_occurrence: Lymphoid leukemia in remission,101,134596
23731101,condition_occurrence: Benign neoplasm of larynx,101,23731
436626101,condition_occurrence: Human ehrlichiosis due to Ehrlichia chaffeensis,101,436626
4228948101,condition_occurrence: Adverse drug event resulting from treatment of disorder,101,4228948
443629101,condition_occurrence: Generalized abdominal tenderness,101,443629
320342101,condition_occurrence: Secondary malignant neoplasm of lymph nodes of multiple sites,101,320342
80177101,condition_occurrence: Pyogenic arthritis of the pelvic region and thigh,101,80177
139900101,condition_occurrence: Urticaria,101,139900
441589101,condition_occurrence: Endocarditis,101,441589
375266101,"condition_occurrence: Serous conjunctivitis, except viral",101,375266
256633101,condition_occurrence: Primary malignant neoplasm of base of tongue,101,256633
192956101,condition_occurrence: Cholecystitis,101,192956
443585101,condition_occurrence: Abrasion and/or friction burn of multiple sites,101,443585
441536101,condition_occurrence: Mixed acid-base balance disorder,101,441536
378419101,condition_occurrence: Alzheimer's disease,101,378419
443563101,condition_occurrence: Arteriosclerosis of coronary artery bypass graft,101,443563
80227101,condition_occurrence: Open fracture of two ribs,101,80227
80498101,condition_occurrence: Ankylosis of joint of ankle AND/OR foot,101,80498
141323101,condition_occurrence: Acute maxillary sinusitis,101,141323
432868101,condition_occurrence: Hemoglobinopathy,101,432868
193733101,condition_occurrence: Neoplasm of uncertain behavior of retroperitoneum and peritoneum,101,193733
372897101,condition_occurrence: Homonymous hemianopia,101,372897
4095756101,condition_occurrence: Malignant tumor of bladder neck,101,4095756
315586101,condition_occurrence: Priapism,101,315586
4229909101,condition_occurrence: Disorder of the nose,101,4229909
72405101,condition_occurrence: Degenerative joint disease of shoulder region,101,72405
440053101,condition_occurrence: Infestation by insect,101,440053
437850101,condition_occurrence: Focal chorioretinitis,101,437850
40480461101,condition_occurrence: Infarction of lung due to iatrogenic pulmonary embolism,101,40480461
72717101,condition_occurrence: Postoperative heterotopic calcification,101,72717
377845101,condition_occurrence: Anoxic encephalopathy,101,377845
4219481101,condition_occurrence: Degenerative joint disease of ankle AND/OR foot,101,4219481
4116351101,condition_occurrence: Carcinoma in situ of ear,101,4116351
321587101,condition_occurrence: Bilateral bundle branch block,101,321587
438751101,condition_occurrence: Lens-induced iridocyclitis,101,438751
433994101,"condition_occurrence: Cocaine dependence, continuous",101,433994
439245101,"condition_occurrence: Mixed bipolar affective disorder, in full remission",101,439245
320425101,condition_occurrence: Heart block,101,320425
44782719101,condition_occurrence: Chronic combined systolic and diastolic heart failure,101,44782719
75039101,condition_occurrence: Loose body in knee,101,75039
74396101,condition_occurrence: Temporomandibular joint disorder,101,74396
376112101,condition_occurrence: Diabetic polyneuropathy,101,376112
45763750101,condition_occurrence: Idiopathic pulmonary fibrosis,101,45763750
133444101,condition_occurrence: Thyroiditis,101,133444
433031101,condition_occurrence: Hallucinations,101,433031
200485101,condition_occurrence: Pressure ulcer of buttock,101,200485
436021101,condition_occurrence: Cutaneous diphtheria,101,436021
438843101,condition_occurrence: Non-traumatic rupture of patellar tendon,101,438843
443939101,condition_occurrence: Superficial foreign body of forearm without major open wound but with infection,101,443939
373463101,condition_occurrence: Cough headache syndrome,101,373463
4066036101,condition_occurrence: Gastroduodenal fistula,101,4066036
27516101,condition_occurrence: Neoplasm of uncertain behavior of paraganglia,101,27516
40480033101,condition_occurrence: Pneumonia due to Staphylococcus aureus,101,40480033
375545101,condition_occurrence: Cataract,101,375545
40483262101,condition_occurrence: Arthritis of shoulder region joint,101,40483262
440424101,condition_occurrence: Aphasia,101,440424
373127101,condition_occurrence: Herpes simplex disciform keratitis,101,373127
434005101,condition_occurrence: Morbid obesity,101,434005
75637101,condition_occurrence: Acquired postural kyphosis,101,75637
4184877101,condition_occurrence: Amputated finger,101,4184877
316135101,condition_occurrence: Atrioventricular block,101,316135
376657101,condition_occurrence: Lipoma of skin and subcutaneous tissue of face,101,376657
40480555101,condition_occurrence: Deep venous thrombosis of peroneal vein,101,40480555
442552101,condition_occurrence: Conjunctival diphtheria,101,442552
373962101,condition_occurrence: Tabes dorsalis,101,373962
433124101,condition_occurrence: Infection by Yersinia enterocolitica,101,433124
138113101,condition_occurrence: Cyst of thyroid,101,138113
440029101,condition_occurrence: Viral disease,101,440029
321109101,condition_occurrence: Congenital anomaly of coronary artery,101,321109
76388101,condition_occurrence: Post-thoracotomy pain syndrome,101,76388
438733101,condition_occurrence: Profound intellectual disability,101,438733
434910101,condition_occurrence: Monocytosis,101,434910
198551101,"condition_occurrence: Embryonic cyst of cervix, vagina and external female genitalia",101,198551
381014101,condition_occurrence: Conjunctival pigmentation,101,381014
252280101,condition_occurrence: Neoplasm of respiratory tract,101,252280
40441585101,condition_occurrence: Stress fracture,101,40441585
4068237101,condition_occurrence: Pyogenic arthritis of ankle,101,4068237
138526101,condition_occurrence: Compartment syndrome of lower limb,101,138526
4300203101,condition_occurrence: Cholelithiasis with obstruction,101,4300203
72997101,condition_occurrence: Articular cartilage disorder of upper arm,101,72997
380534101,condition_occurrence: Tetany,101,380534
440328101,condition_occurrence: Pneumococcal infectious disease,101,440328
313223101,condition_occurrence: Granulomatosis with polyangiitis,101,313223
4112529101,condition_occurrence: Chronic ulcerative rhinitis,101,4112529
443114101,condition_occurrence: Open fracture finger proximal phalanx,101,443114
74511101,condition_occurrence: Open wound of knee and/or leg and/or ankle with complication,101,74511
137426101,condition_occurrence: Open wound of forearm without complication,101,137426
4155529101,condition_occurrence: Mechanical complication of intrauterine contraceptive device,101,4155529
201265101,condition_occurrence: Disorder of spleen,101,201265
40493415101,condition_occurrence: Sepsis due to Serratia,101,40493415
444234101,condition_occurrence: Late effect of complications of trauma,101,444234
197381101,condition_occurrence: Epigastric pain,101,197381
441872101,condition_occurrence: Supraventricular premature beats,101,441872
198185101,condition_occurrence: Chronic renal failure,101,198185
440078101,"condition_occurrence: Bipolar affective disorder, current episode manic",101,440078
437943101,condition_occurrence: Pulp abscess of finger,101,437943
79768101,condition_occurrence: Neoplasm of urinary system,101,79768
134825101,condition_occurrence: Frostbite of face,101,134825
435506101,condition_occurrence: Benign neoplastic disease,101,435506
198850101,condition_occurrence: Congenital hypoplasia of penis,101,198850
433618101,condition_occurrence: Open fracture of patella,101,433618
80229101,condition_occurrence: Open fracture of one rib,101,80229
75035101,condition_occurrence: Arthropathy associated with non-infective gastrointestinal disorder,101,75035
437363101,condition_occurrence: Acquired valgus deformity of wrist,101,437363
373748101,condition_occurrence: Grand mal status,101,373748
198031101,"condition_occurrence: Foreign body in uterus, any part",101,198031
4337456101,condition_occurrence: Hypoactive labyrinthine dysfunction,101,4337456
438430101,condition_occurrence: Squamous blepharitis,101,438430
318736101,condition_occurrence: Migraine,101,318736
441321101,condition_occurrence: Chronic nasopharyngitis,101,441321
198797101,condition_occurrence: Umbilical hernia with gangrene,101,198797
40484013101,condition_occurrence: Stress fracture of fibula,101,40484013
374028101,condition_occurrence: Age related macular degeneration,101,374028
4185932101,condition_occurrence: Ischemic heart disease,101,4185932
74120101,condition_occurrence: Arthropathy of the shoulder region associated with helminthiasis,101,74120
377545101,condition_occurrence: Episodic tension-type headache,101,377545
254061101,condition_occurrence: Pleural effusion,101,254061
434587101,condition_occurrence: Primary malignant neoplasm of dorsal surface of tongue,101,434587
443580101,condition_occurrence: Systolic heart failure,101,443580
434697101,condition_occurrence: Maternal tobacco abuse,101,434697
72618101,condition_occurrence: Disorder of skeletal muscle,101,72618
374954101,condition_occurrence: Optic neuritis,101,374954
437993101,condition_occurrence: Closed fracture of cervical spine,101,437993
378140101,condition_occurrence: Inflammatory and toxic neuropathy,101,378140
375415101,condition_occurrence: Injury of head,101,375415
81931101,condition_occurrence: Psoriasis with arthropathy,101,81931
201908101,condition_occurrence: Chronic pyelonephritis with medullary necrosis,101,201908
4163058101,condition_occurrence: Opioid analgesic allergy,101,4163058
435578101,condition_occurrence: Acute duodenal ulcer with perforation but without obstruction,101,435578
196461101,condition_occurrence: Bilateral recurrent femoral hernia with obstruction but no gangrene,101,196461
136580101,condition_occurrence: Dehiscence of surgical wound,101,136580
133857101,condition_occurrence: Acquired deformity of limb,101,133857
72995101,condition_occurrence: Contracture of joint of hand,101,72995
194691101,condition_occurrence: Healed tear of anal sphincter,101,194691
434616101,condition_occurrence: Hemoglobinuria due to hemolysis from external causes,101,434616
376981101,condition_occurrence: Amblyopia,101,376981
440499101,condition_occurrence: Villonodular synovitis of the upper arm,101,440499
438567101,condition_occurrence: Adult failure to thrive syndrome,101,438567
433617101,condition_occurrence: Open fracture of femoral condyle of femur,101,433617
140966101,condition_occurrence: Benign neoplasm of skin of face,101,140966
443391101,condition_occurrence: Malignant tumor of cecum,101,443391
192363101,condition_occurrence: Obstruction of gallbladder,101,192363
77124101,condition_occurrence: Open fracture of scaphoid bone of wrist,101,77124
138826101,condition_occurrence: Acne varioliformis,101,138826
196438101,condition_occurrence: Acquired arteriovenous fistula of liver,101,196438
256531101,condition_occurrence: Head and neck swelling,101,256531
379819101,condition_occurrence: Protan defect,101,379819
192273101,condition_occurrence: Benign neoplasm of adrenal gland,101,192273
437176101,condition_occurrence: Late effect of accidental fall,101,437176
256036101,condition_occurrence: Hemorrhagic varicella pneumonitis,101,256036
201912101,"condition_occurrence: Renal hypertension complicating pregnancy, childbirth and the puerperium - delivered with postnatal complication",101,201912
373756101,condition_occurrence: Exudative retinopathy,101,373756
435726101,condition_occurrence: Mechanical complication of device,101,435726
440710101,condition_occurrence: Intraretinal microvascular abnormality,101,440710
317109101,condition_occurrence: Respiratory arrest,101,317109
434073101,condition_occurrence: Acquired absence of teeth,101,434073
313791101,condition_occurrence: Bundle branch block,101,313791
321822101,condition_occurrence: Peripheral vascular disorder due to diabetes mellitus,101,321822
194286101,"condition_occurrence: Malignant neoplasm of corpus uteri, excluding isthmus",101,194286
440736101,condition_occurrence: Endocarditis associated with another disorder,101,440736
440385101,condition_occurrence: Obstructive hydrocephalus,101,440385
40493238101,condition_occurrence: Sector visual field defect,101,40493238
380398101,condition_occurrence: Hereditary sensory neuropathy,101,380398
201045101,condition_occurrence: Thrombosed external hemorrhoids,101,201045
75010101,condition_occurrence: Fibroadenosis of breast,101,75010
78524101,condition_occurrence: Acquired deformity of finger,101,78524
443735101,condition_occurrence: Coma associated with diabetes mellitus,101,443735
