covariate_id,covariate_name,analysis_id,concept_id
443948101,condition_occurrence: Open dislocation of sixth cervical vertebra,101,443948
444371101,condition_occurrence: Abrasion and/or friction burn of finger without infection,101,444371
438268101,condition_occurrence: Closed traumatic dislocation of joint of finger,101,438268
432719101,condition_occurrence: Panniculitis,101,432719
434638101,condition_occurrence: Paramacular focal retinitis AND retinochoroiditis,101,434638
443464101,condition_occurrence: Central pain syndrome,101,443464
438005101,condition_occurrence: Closed fracture of shaft of fibula,101,438005
443235101,condition_occurrence: Ankle and/or foot joint stiffness,101,443235
317895101,condition_occurrence: Renovascular hypertension,101,317895
260028101,condition_occurrence: Post measles pneumonia,101,260028
434376101,condition_occurrence: Acute myocardial infarction of anterior wall,101,434376
141438101,condition_occurrence: Open wound of buccal mucosa with complication,101,141438
134734101,condition_occurrence: Compartment syndrome,101,134734
195861101,condition_occurrence: Small kidney,101,195861
196821101,condition_occurrence: Urethral discharge,101,196821
80879101,condition_occurrence: Open wound of upper arm with tendon involvement,101,80879
4027782101,condition_occurrence: Lipid storage disease,101,4027782
440855101,condition_occurrence: Closed fracture of base of metacarpal bone other than first metacarpal,101,440855
441706101,"condition_occurrence: Closed traumatic dislocation, midtarsal joint",101,441706
440392101,condition_occurrence: Retinal vascular occlusion,101,440392
138388101,condition_occurrence: Secondary hyperparathyroidism,101,138388
4088910101,condition_occurrence: Uterine cervix absent,101,4088910
133510101,condition_occurrence: Rapidly progressive periodontitis,101,133510
316429101,condition_occurrence: Premature beats,101,316429
440320101,condition_occurrence: Infection due to Escherichia coli,101,440320
438106101,"condition_occurrence: Reticulosarcoma of lymph nodes of head, face and neck",101,438106
80800101,condition_occurrence: Polymyositis,101,80800
436659101,condition_occurrence: Iron deficiency anemia,101,436659
199856101,condition_occurrence: Varicose veins of lower extremity with inflammation,101,199856
40481140101,condition_occurrence: Childhood obesity,101,40481140
4102183101,condition_occurrence: Borderline glaucoma,101,4102183
374919101,condition_occurrence: Multiple sclerosis,101,374919
198201101,condition_occurrence: Chronic salpingo-oophoritis,101,198201
24076101,condition_occurrence: Chronic peptic ulcer with hemorrhage AND obstruction,101,24076
440296101,condition_occurrence: Poisoning by antifungal antibiotic,101,440296
374955101,condition_occurrence: Spasm of conjugate gaze,101,374955
435502101,condition_occurrence: Macroglobulinemia,101,435502
45766714101,condition_occurrence: Inflammatory dermatosis,101,45766714
435636101,condition_occurrence: Juvenile osteochondritis of hip AND/OR pelvis,101,435636
196271101,condition_occurrence: Injury of retroperitoneum without open wound into abdominal cavity,101,196271
432345101,condition_occurrence: Hypertrophy of tongue papillae,101,432345
80484101,condition_occurrence: Crystal arthropathy,101,80484
4180641101,condition_occurrence: Complication of respiratory therapy procedure,101,4180641
4038835101,condition_occurrence: Hodgkin's disease,101,4038835
434303101,condition_occurrence: Benign neoplasm of rectum and anal canal,101,434303
436976101,condition_occurrence: Posterior subcapsular polar cataract,101,436976
4034608101,condition_occurrence: Inhalational anthrax,101,4034608
195480101,condition_occurrence: Primary malignant neoplasm of renal pelvis,101,195480
40489907101,condition_occurrence: Sepsis due to Staphylococcus aureus,101,40489907
433751101,condition_occurrence: Prolonged depressive adjustment reaction,101,433751
44783163101,condition_occurrence: Pressure ulcer of lower back,101,44783163
138844101,condition_occurrence: Foreign body granuloma of muscle,101,138844
80861101,condition_occurrence: Closed fracture of ischium,101,80861
4009610101,"condition_occurrence: Closed fracture proximal femur, subtrochanteric",101,4009610
439800101,"condition_occurrence: Conduct disorder, adolescent-onset type",101,439800
439005101,condition_occurrence: Chronic alcoholism in remission,101,439005
24978101,condition_occurrence: Chronic adenotonsillitis,101,24978
438727101,condition_occurrence: Atypical depressive disorder,101,438727
201903101,condition_occurrence: Chronic subinvolution of uterus,101,201903
4029488101,condition_occurrence: Hepatic encephalopathy,101,4029488
4043382101,condition_occurrence: Inguinal hernia with gangrene,101,4043382
4247710101,condition_occurrence: Effusion of joint of pelvic region,101,4247710
441541101,condition_occurrence: Lymphocytopenia,101,441541
77815101,"condition_occurrence: Benign neoplasm of vertebral column, excluding sacrum and coccyx",101,77815
436093101,condition_occurrence: Disseminated intravascular coagulation,101,436093
438141101,condition_occurrence: Senile reticular retinal degeneration,101,438141
440628101,condition_occurrence: Infection due to Brucella abortus,101,440628
380742101,condition_occurrence: Inner ear conductive hearing loss,101,380742
24230101,condition_occurrence: Foreign body in larynx,101,24230
195213101,condition_occurrence: Hyperaldosteronism,101,195213
133569101,condition_occurrence: Fasciitis,101,133569
434332101,condition_occurrence: Catatonic schizophrenia in remission,101,434332
195309101,condition_occurrence: Eosinophilic gastritis,101,195309
376663101,condition_occurrence: Vitamin A deficiency with conjunctival xerosis,101,376663
438468101,condition_occurrence: Acute gastrojejunal ulcer with hemorrhage but without obstruction,101,438468
375229101,condition_occurrence: Organic delusional disorder,101,375229
441500101,condition_occurrence: Bacterial food poisoning,101,441500
4115830101,condition_occurrence: Loose body in hip joint,101,4115830
438120101,condition_occurrence: Opioid dependence,101,438120
79804101,condition_occurrence: Steinert myotonic dystrophy syndrome,101,79804
432585101,condition_occurrence: Blood coagulation disorder,101,432585
40479606101,condition_occurrence: Septic pulmonary embolism,101,40479606
74507101,condition_occurrence: Sprain of radiohumeral joint,101,74507
194847101,condition_occurrence: Mechanical complication due to urethral indwelling catheter,101,194847
440358101,condition_occurrence: Lipoma,101,440358
437269101,condition_occurrence: Intermittent angle-closure glaucoma,101,437269
254058101,condition_occurrence: Acute bronchiolitis due to respiratory syncytial virus,101,254058
133013101,condition_occurrence: Congenital anomaly of spinal cord,101,133013
437504101,"condition_occurrence: Burkitt's tumor of lymph nodes of head, face AND/OR neck",101,437504
201965101,condition_occurrence: Shock,101,201965
433911101,condition_occurrence: Contusion of eye AND ocular adnexa,101,433911
4181251101,condition_occurrence: Finding of wrist joint,101,4181251
439233101,condition_occurrence: Poisoning by antidiabetic agent,101,439233
132776101,condition_occurrence: Injury involving multiple body regions,101,132776
432851101,condition_occurrence: Secondary malignant neoplastic disease,101,432851
198085101,condition_occurrence: Kaposi's sarcoma of gastrointestinal tract,101,198085
377552101,condition_occurrence: Moderate nonproliferative diabetic retinopathy,101,377552
435810101,condition_occurrence: After-cataract,101,435810
375820101,condition_occurrence: Adhesive middle ear disease,101,375820
134380101,condition_occurrence: Erythromelalgia,101,134380
434953101,condition_occurrence: Orbital granuloma,101,434953
372891101,condition_occurrence: Microcystoid retinal degeneration,101,372891
198900101,condition_occurrence: Bilateral traumatic amputation of legs at any level without complication,101,198900
192242101,condition_occurrence: Acute hepatitis C,101,192242
76255101,condition_occurrence: Sprain of iliofemoral ligament,101,76255
374034101,condition_occurrence: Visual disturbance,101,374034
442275101,condition_occurrence: Tritan defect,101,442275
80816101,condition_occurrence: Degeneration of intervertebral disc,101,80816
376964101,condition_occurrence: Partial recent retinal detachment with giant tear,101,376964
439276101,condition_occurrence: Uncomplicated arteriosclerotic dementia,101,439276
441803101,condition_occurrence: Lymphosarcoma of lymph nodes of axilla and upper limb,101,441803
435754101,condition_occurrence: Malignant tumor of ascending colon,101,435754
4219627101,condition_occurrence: Agoraphobia without history of panic disorder without limited symptom attacks,101,4219627
4309542101,condition_occurrence: Infection due to anaerobic bacteria,101,4309542
4091467101,condition_occurrence: Malignant neoplasm of axillary tail of female breast,101,4091467
4019044101,condition_occurrence: Ischiocapsular sprain,101,4019044
40480416101,condition_occurrence: Complete tetraplegia due to lesion at C1-C4 level,101,40480416
440448101,condition_occurrence: Appendicitis,101,440448
74136101,condition_occurrence: Muscle calcification and ossification,101,74136
199074101,condition_occurrence: Acute pancreatitis,101,199074
375800101,condition_occurrence: Dystonia,101,375800
80804101,condition_occurrence: Allergic arthritis of multiple sites,101,80804
375826101,condition_occurrence: Central hearing loss,101,375826
200169101,condition_occurrence: Pruritus ani,101,200169
376946101,condition_occurrence: Senile dementia with delirium,101,376946
4084966101,condition_occurrence: Candida infection of genital region,101,4084966
193787101,condition_occurrence: Varicose veins of lower extremity with ulcer AND inflammation,101,193787
313430101,condition_occurrence: Subacute monocytic leukemia,101,313430
318556101,condition_occurrence: Epistaxis,101,318556
74114101,condition_occurrence: Cellulitis and abscess of foot excluding toe,101,74114
315288101,condition_occurrence: Dissecting aneurysm of artery,101,315288
201901101,condition_occurrence: Abscess of liver,101,201901
74470101,condition_occurrence: Congenital anomaly of upper limb,101,74470
201347101,condition_occurrence: Pelvic congestion syndrome,101,201347
192577101,condition_occurrence: Carcinoma in situ of female genital organ,101,192577
40480938101,condition_occurrence: Monoplegia of lower limb as late effect of cerebrovascular disease,101,40480938
437966101,condition_occurrence: Calcium deposits in tendon,101,437966
140064101,condition_occurrence: Myelosclerosis with myeloid metaplasia,101,140064
73550101,condition_occurrence: Crystal arthropathy of elbow,101,73550
80951101,condition_occurrence: Candidiasis of urogenital site,101,80951
437728101,condition_occurrence: Blister of finger with infection,101,437728
440039101,condition_occurrence: Specific viral infections,101,440039
377294101,condition_occurrence: Exotropia,101,377294
435903101,condition_occurrence: Juvenile osteochondrosis of foot,101,435903
438867101,condition_occurrence: Generalized aches and pains,101,438867
198062101,"condition_occurrence: Infectious colitis, enteritis and gastroenteritis",101,198062
312336101,condition_occurrence: Arterial aneurysm,101,312336
433734101,condition_occurrence: Acute exacerbation of chronic latent schizophrenia,101,433734
75347101,condition_occurrence: Spinal enthesopathy,101,75347
78804101,condition_occurrence: Fibrocystic disease of breast,101,78804
77639101,condition_occurrence: Diffuse cervicobrachial syndrome,101,77639
78219101,condition_occurrence: Cellulitis and abscess of hand excluding digits,101,78219
4109883101,"condition_occurrence: Esophageal varices without bleeding, associated with another disorder",101,4109883
4068379101,condition_occurrence: Inflammatory spondylopathy associated with another disorder,101,4068379
378145101,condition_occurrence: Chronic cluster headache,101,378145
197490101,condition_occurrence: Acute hepatitis E,101,197490
74129101,condition_occurrence: Allergic arthritis of the ankle and/or foot,101,74129
320743101,condition_occurrence: Rheumatic myocarditis,101,320743
192732101,condition_occurrence: Splitting of urinary stream,101,192732
201727101,condition_occurrence: Superficial injury of trunk without infection,101,201727
436110101,condition_occurrence: Glaucoma associated with ocular inflammation,101,436110
441266101,condition_occurrence: Thiamine deficiency,101,441266
433456101,condition_occurrence: Acute pain,101,433456
193120101,condition_occurrence: Adenoviral enteritis,101,193120
435138101,condition_occurrence: Injury of femoral nerve,101,435138
72714101,condition_occurrence: Chronic polyarticular juvenile rheumatoid arthritis,101,72714
440756101,"condition_occurrence: Chronic duodenal ulcer with hemorrhage, with perforation AND with obstruction",101,440756
199872101,condition_occurrence: Chronic pyelonephritis without medullary necrosis,101,199872
432513101,condition_occurrence: Animal bite wound,101,432513
442120101,condition_occurrence: Injection site extravasation,101,442120
4146239101,condition_occurrence: Pruritus of genital organs,101,4146239
374641101,condition_occurrence: Round hole of retina without detachment,101,374641
373179101,condition_occurrence: Senile degeneration of brain,101,373179
28403101,condition_occurrence: Gigantism and acromegaly,101,28403
135350101,condition_occurrence: Acute osteomyelitis of ankle and/or foot,101,135350
441973101,condition_occurrence: Closed fracture of proximal end of radius,101,441973
441328101,condition_occurrence: Acute gastrojejunal ulcer with hemorrhage AND with perforation but without obstruction,101,441328
75311101,condition_occurrence: Fibrosclerosis of breast,101,75311
199978101,condition_occurrence: Contusion of lower limb,101,199978
199771101,condition_occurrence: Carcinoid syndrome,101,199771
136982101,condition_occurrence: Trichiasis without entropion,101,136982
381537101,condition_occurrence: Organic anxiety disorder,101,381537
438171101,condition_occurrence: Rupture of chordae tendineae,101,438171
194093101,condition_occurrence: Postcoital bleeding,101,194093
73614101,condition_occurrence: Closed fracture of seven ribs,101,73614
376401101,condition_occurrence: Traumatic cataract,101,376401
4173657101,condition_occurrence: Congenital malformation of the respiratory system,101,4173657
76202101,condition_occurrence: Non-traumatic rupture of Achilles tendon,101,76202
378734101,condition_occurrence: Intraspinal abscess,101,378734
373489101,condition_occurrence: Congenital nystagmus,101,373489
437388101,"condition_occurrence: Multiple open fractures of skull AND/OR face with subarachnoid, subdural AND/OR extradural hemorrhage",101,437388
79765101,condition_occurrence: Neoplasm of uncertain behavior of urinary system,101,79765
136354101,condition_occurrence: Secondary malignant neoplasm of skin,101,136354
197145101,condition_occurrence: Open wound of pelvic region without complication,101,197145
439096101,condition_occurrence: Actinic reticuloid,101,439096
137350101,condition_occurrence: Radiation dermatitis,101,137350
40484640101,condition_occurrence: Infection by Streptococcus group C,101,40484640
195682101,condition_occurrence: Pelvic organ injury without open wound into abdominal cavity,101,195682
133974101,condition_occurrence: Overlapping malignant neoplasm of skin,101,133974
137800101,condition_occurrence: Primary malignant neoplasm of maxillary sinus,101,137800
40481354101,condition_occurrence: Speech and language deficit as late effect of cerebrovascular accident,101,40481354
133419101,condition_occurrence: Overlapping malignant melanoma of skin,101,133419
443560101,condition_occurrence: Anaphylaxis due to fish,101,443560
434247101,condition_occurrence: Poisoning by antirheumatic,101,434247
193512101,condition_occurrence: Embolism and thrombosis of the renal vein,101,193512
135695101,condition_occurrence: Partial thickness burn of chin,101,135695
195591101,condition_occurrence: Urethral overactivity,101,195591
377853101,condition_occurrence: Chronic tension-type headache,101,377853
433774101,condition_occurrence: Orbital myositis,101,433774
196168101,condition_occurrence: Irregular periods,101,196168
440516101,condition_occurrence: Congenital ureterovesical obstruction,101,440516
132392101,condition_occurrence: Staphylococcal scalded skin syndrome,101,132392
200766101,condition_occurrence: Ureteric fistula,101,200766
40480639101,condition_occurrence: Dissecting aneurysm of thoracoabdominal aorta,101,40480639
195464101,condition_occurrence: Epidemic pleurodynia,101,195464
196433101,condition_occurrence: Aneurysm of iliac artery,101,196433
4115208101,condition_occurrence: Ankylosis of the elbow joint,101,4115208
75103101,condition_occurrence: Sprain of jaw,101,75103
201909101,condition_occurrence: Female infertility,101,201909
437847101,condition_occurrence: Partial retinal artery occlusion,101,437847
135778101,condition_occurrence: Toxic multinodular goiter,101,135778
77348101,condition_occurrence: Arthropathy associated with viral disease,101,77348
443551101,condition_occurrence: Apraxia due to cerebrovascular accident,101,443551
195209101,condition_occurrence: Benign neoplasm of liver and/or biliary ducts,101,195209
441421101,condition_occurrence: Closed fracture of fourth cervical vertebra,101,441421
73068101,condition_occurrence: Superficial foreign body of finger without major open wound but with infection,101,73068
254832101,condition_occurrence: Injury at T7-T12 level with central cord syndrome AND without bone injury,101,254832
440221101,condition_occurrence: Open skull fracture without intracranial injury,101,440221
194607101,condition_occurrence: Benign neoplasm of soft tissues of pelvis,101,194607
437442101,condition_occurrence: Cow's milk protein-induced anaphylaxis,101,437442
372479101,condition_occurrence: Laceration of eye,101,372479
435814101,condition_occurrence: Degenerative changes of ciliary body,101,435814
4220617101,"condition_occurrence: Severe bipolar I disorder, single manic episode with psychotic features",101,4220617
196476101,condition_occurrence: Extravaginal torsion of spermatic cord,101,196476
140633101,condition_occurrence: Vaccinia,101,140633
376901101,"condition_occurrence: Acute paralytic poliomyelitis, bulbar",101,376901
193874101,condition_occurrence: Nocturnal enuresis,101,193874
255677101,condition_occurrence: Open wound of nose without complication,101,255677
435968101,condition_occurrence: Open wound of jaw with complication,101,435968
132835101,condition_occurrence: Pediculosis capitis,101,132835
442295101,condition_occurrence: Disorder of carbohydrate transport,101,442295
133294101,condition_occurrence: Prepatellar bursitis,101,133294
40480077101,condition_occurrence: Periprosthetic osteolysis,101,40480077
192901101,condition_occurrence: Hereditary spastic paraplegia,101,192901
380038101,condition_occurrence: Viral conjunctivitis,101,380038
378081101,condition_occurrence: Overlapping malignant neoplasm of soft tissues,101,378081
259827101,condition_occurrence: Disorder of visual pathways associated with neoplasm,101,259827
440388101,condition_occurrence: Developmental coordination disorder,101,440388
436254101,condition_occurrence: Closed fractures of multiple bones of lower limb,101,436254
321307101,condition_occurrence: Chronic rheumatic pericarditis,101,321307
373772101,condition_occurrence: Vitreoretinal dystrophy,101,373772
441130101,condition_occurrence: Meningeal irritation,101,441130
314667101,condition_occurrence: Nonpyogenic thrombosis of intracranial venous sinus,101,314667
28716101,condition_occurrence: Benign neoplasm of aortic body,101,28716
194802101,condition_occurrence: Foreign body in vulva and vagina,101,194802
197318101,condition_occurrence: Cholesterolosis of gallbladder,101,197318
442119101,condition_occurrence: Adhesions of temporomandibular joint,101,442119
438223101,condition_occurrence: Sunburn of second degree,101,438223
4342875101,condition_occurrence: Congenital malformation of pancreas,101,4342875
435244101,condition_occurrence: Developmental disorder,101,435244
80504101,condition_occurrence: Acquired genu valgum,101,80504
73555101,condition_occurrence: Transient arthropathy of the pelvic region and thigh,101,73555
260434101,condition_occurrence: Acute radiation pneumonitis,101,260434
72401101,condition_occurrence: Kashin-Bek disease,101,72401
439670101,condition_occurrence: Acute secondary syphilitic meningitis,101,439670
40481374101,condition_occurrence: Allergic rhinitis due to food,101,40481374
313159101,condition_occurrence: Megakaryocytic leukemia,101,313159
434670101,condition_occurrence: Humidifier lung,101,434670
438997101,condition_occurrence: Neoplasm of uncertain behavior of meninges,101,438997
381559101,condition_occurrence: Sensory disorder of eyelid,101,381559
377270101,condition_occurrence: Hereditary retinal dystrophy,101,377270
375821101,condition_occurrence: Paralytic lagophthalmos,101,375821
440697101,condition_occurrence: Nonaggressive unsocial conduct disorder,101,440697
434887101,condition_occurrence: Disorders of bilirubin excretion,101,434887
435812101,condition_occurrence: Disseminated chorioretinal scars,101,435812
195259101,condition_occurrence: Meralgia paresthetica,101,195259
440088101,condition_occurrence: Academic underachievement disorder,101,440088
376189101,condition_occurrence: Benign mucous membrane pemphigoid with ocular involvement,101,376189
138027101,condition_occurrence: Traumatic subcutaneous emphysema,101,138027
436421101,"condition_occurrence: Mixed conductive and sensorineural hearing loss, bilateral",101,436421
138612101,condition_occurrence: Injury of cervical nerve roots,101,138612
75383101,"condition_occurrence: Open traumatic dislocation of glenohumeral joint, inferior",101,75383
442293101,condition_occurrence: Secondary retinal cyst,101,442293
4141201101,condition_occurrence: Beta lactam resistant bacterial infection,101,4141201
25965101,condition_occurrence: Open wound of larynx without complication,101,25965
136538101,condition_occurrence: Closed fracture larynx and/or trachea,101,136538
75942101,condition_occurrence: Open fracture of rib,101,75942
374906101,condition_occurrence: Cerebral lipidosis,101,374906
373101101,condition_occurrence: Injury of ulnar nerve,101,373101
438167101,condition_occurrence: Attic perforation of tympanic membrane,101,438167
435626101,condition_occurrence: Tibial collateral ligament bursitis,101,435626
376387101,condition_occurrence: Spasmodic torticollis,101,376387
437537101,condition_occurrence: Shyness disorder of childhood,101,437537
437655101,condition_occurrence: Undescended testicle,101,437655
197518101,condition_occurrence: Neoplasm of uncertain behavior of male genital organ,101,197518
40482030101,condition_occurrence: Dysplasia of prostate,101,40482030
373488101,condition_occurrence: Partial oculomotor nerve palsy,101,373488
74189101,condition_occurrence: Sprain of cruciate ligament of knee,101,74189
313500101,condition_occurrence: Acute rheumatic heart disease,101,313500
436129101,condition_occurrence: Orbital deformity associated with craniofacial deformity,101,436129
194405101,condition_occurrence: Nephrotic syndrome with membranous glomerulonephritis,101,194405
442783101,condition_occurrence: Arenaviral hemorrhagic fever,101,442783
381867101,condition_occurrence: Chronic enlargement of lacrimal gland,101,381867
134290101,condition_occurrence: Primary malignant neoplasm of palate,101,134290
436043101,condition_occurrence: Overlapping malignant neoplasm of tongue,101,436043
374956101,condition_occurrence: Anterior dislocation of lens,101,374956
320737101,condition_occurrence: Hyperkinetic heart disease,101,320737
438658101,condition_occurrence: Traumatic anuria,101,438658
138299101,condition_occurrence: Complication of reattached extremity AND/OR body part,101,138299
75426101,condition_occurrence: Burn of hand,101,75426
442314101,"condition_occurrence: Acute gastrojejunal ulcer with hemorrhage, with perforation AND with obstruction",101,442314
376989101,condition_occurrence: Duane's syndrome,101,376989
30284101,condition_occurrence: Motion sickness,101,30284
27918101,condition_occurrence: Eosinophilic esophagitis,101,27918
140273101,condition_occurrence: Contusion of forearm,101,140273
141456101,condition_occurrence: Chilblains,101,141456
433752101,condition_occurrence: Impulse control disorder,101,433752
4209083101,condition_occurrence: Apparent life-threatening event,101,4209083
196276101,"condition_occurrence: Open wound of knee, leg and ankle with tendon involvement",101,196276
78706101,condition_occurrence: Benign neoplasm of urinary system,101,78706
134141101,condition_occurrence: Chronic osteomyelitis of lower leg,101,134141
440715101,condition_occurrence: Parasitic endophthalmitis,101,440715
377546101,condition_occurrence: Chronic post-traumatic headache,101,377546
438930101,condition_occurrence: Accidental poisoning by drug affecting blood constituent,101,438930
433531101,condition_occurrence: Polyp of vulva,101,433531
78241101,condition_occurrence: Congenital genu recurvatum,101,78241
375355101,condition_occurrence: Corneal size and shape anomalies,101,375355
443901101,condition_occurrence: Toxic effect of carbon tetrachloride,101,443901
77066101,condition_occurrence: Derangement of medial meniscus,101,77066
436701101,condition_occurrence: Drusen of optic disc,101,436701
201619101,condition_occurrence: Gastric diverticulum,101,201619
78507101,condition_occurrence: Pathological dislocation of shoulder region,101,78507
40481620101,condition_occurrence: Infective arthritis of ankle and/or foot,101,40481620
438410101,condition_occurrence: Psychogenic dysuria,101,438410
380111101,condition_occurrence: Acute atopic conjunctivitis,101,380111
193528101,condition_occurrence: Third degree uterine prolapse,101,193528
